{"corpora":{"correctness":{"generated_by":"python3 tests/datasets/generate.py committed","path":"tests/datasets/correctness/corpus.jsonl","record_count":347,"sha256":"745d3274c90e85f4cda46d787846e6282962ffc69fd018b3e4e16a7f1728e909"},"performance":{"generated_by":"python3 tests/datasets/generate.py performance --output .local/datasets/performance-corpus.jsonl","path":"tests/datasets/performance/manifest.json","record_count":200000,"sha256":"44040c1c922b544db549158eb0b971911b7e71d3b0b59debed86cf9cdd128bbc"},"rejections":{"generated_by":"python3 tests/datasets/generate.py committed","path":"tests/datasets/rejections/corpus.jsonl","record_count":9,"sha256":"b430917651d53dbe185b25c95d533cfa3fd76cc7070928b498ebfe3950d94641"}},"coverage":{"correctness_required":["new-field-objects","reused-field-objects","new-data-objects","reused-data-objects","duplicate-fields-in-entry","duplicate-values-across-entries","binary-field-values","embedded-nul-value","zero-length-value","large-value","compression-threshold-values","high-cardinality-fields","low-cardinality-fields","hash-collision-pressure","entry-array-growth","data-entry-array-growth","sorted-entry-item-ordering"],"rejections_required":["empty-field-name","lowercase-field-name","field-name-starts-with-digit","field-name-too-long","field-name-invalid-character","missing-equals","empty-full-data-payload","null-field-payload","value-exceeds-limit"]},"dataset_version":"1.0.0","determinism":{"base_monotonic_usec":50000000,"base_realtime_usec":1700000000000000,"boot_id":"0123456789abcdef0123456789abcdef","invocation_id":"11112222333344445555666677778888","json":"UTF-8, sorted object keys, compact separators, one JSON record per line","machine_id":"fedcba9876543210fedcba9876543210","seed":24989294317},"schema_version":"1.0.0","systemd_baseline":{"commit":"c0a5a2516d28601fb3afc1a77d7b42fcfe38fced","repo":"systemd/systemd","tag":"v260.1"}}
